<?xml version="1.0"  encoding="US-ASCII"?>

<!DOCTYPE ClusterAssets SYSTEM "ClusterAssets.ldm.dtd" []>

<clusterassets>
  <prototype name="NSN/F18">
    <object class="org.cougaar.glm.ldm.asset.FixedWingAircraftWeapon" id="proto-001">
      <property class="org.cougaar.planning.ldm.asset.TypeIdentificationPG" id="property-001">
	<field value="NSN/F18" type="java.lang.String" name="TypeIdentification"/>
	<field value="F18" type="java.lang.String" name="Nomenclature"/>
      </property>
    </object>
  </prototype>
  <instance prototype="NSN/F18" id="b001">
    <schedule start="01/01/99" end="12/31/10"/>
  </instance>
  <instance prototype="NSN/F18" id="b002">
    <schedule start="01/01/99" end="12/31/10"/>
  </instance>
  <instance prototype="NSN/F18" id="b003">
    <schedule start="01/01/99" end="12/31/10"/>
  </instance>
  <instance prototype="NSN/F18" id="b004">
    <schedule start="01/01/99" end="12/31/10"/>
  </instance>
  <instance prototype="NSN/F18" id="b005">
    <schedule start="01/01/99" end="12/31/10"/>
  </instance>
  <instance prototype="NSN/F18" id="b006">
    <schedule start="01/01/99" end="12/31/10"/>
  </instance>
  <instance prototype="NSN/F18" id="b007">
    <schedule start="01/01/99" end="12/31/10"/>
  </instance>
  <instance prototype="NSN/F18" id="b008">
    <schedule start="01/01/99" end="12/31/10"/>
  </instance>
  <instance prototype="NSN/F18" id="b009">
    <schedule start="01/01/99" end="12/31/10"/>
  </instance>
  <instance prototype="NSN/F18" id="b010">
    <schedule start="01/01/99" end="12/31/10"/>
  </instance>
  <instance prototype="NSN/F18" id="b011">
    <schedule start="01/01/99" end="12/31/10"/>
  </instance>
  <instance prototype="NSN/F18" id="b012">
    <schedule start="01/01/99" end="12/31/10"/>
  </instance>
</clusterassets>
